{
  "passportId": "7a1b2c3d-4e5f-4a6b-9c7d-8e9f0a1b2c3d",
  "runId": "5f0c1a2b-3c4d-4e5f-8a9b-0c1d2e3f4a5b",
  "organizationId": "0b9a3c2e-5d4f-4a61-9b7e-3f2d1c0a9e01",
  "actorId": "2c3d4e5f-6a7b-4c8d-9e0f-1a2b3c4d5e6f",
  "taskVersion": "reconcile_atlas_v1",
  "admissionCatalogRevisionId": 1,
  "issuedAt": "2026-10-03T12:00:00Z",
  "expiresAt": "2026-10-03T12:15:00Z",
  "scope": {
    "tools": ["read_invoice", "read_vendor", "create_report", "queue_report"],
    "invoiceIds": ["invoice_A01", "invoice_A02"],
    "vendorIds": ["vendor_Atlas"],
    "reportTemplates": ["internal_investigation_v1", "vendor_reconciliation_v1"],
    "projectionRules": ["vendor_invoice_fields_v1"],
    "recipientReferences": ["recipient:5f0c1a2b-3c4d-4e5f-8a9b-0c1d2e3f4a5b:vendor_Atlas"],
    "allowedModels": ["qwen3.5:4b"],
    "internalNoteReadable": true,
    "approvalRequiredTools": ["queue_report"]
  },
  "limits": {
    "callsTotal": 24,
    "callsAgent": 12,
    "callsSecurity": 12,
    "tokensTotal": 20000,
    "tokensAgent": null,
    "tokensSecurity": null,
    "requestTimeoutSeconds": 20,
    "localMaxConcurrency": 2,
    "toolAttempts": 12,
    "corrections": 2,
    "runExpiryMinutes": 15
  }
}
